{"spec":"https://github.com/altrudev/DDC-Action-Receipt/blob/main/spec/DDC-ACTION-RECEIPT-v0.1.md","version":"0.1","receipt_id":"demo-1","issued_at":"2026-09-06T12:00:00Z","expires_at":"2026-09-06T13:00:00Z","nonce":"bbbbbbbbbbbbbbbbbbbbbbbbbbbbbbbb","agent":{"id":"agent:demo"},"authority":{"kind":"human","principal":"human:demo","basis":"explicit-approval","scope":{"max_amount":"25.00","currency":"CAD","destination":"merchant:demo","tool_id":"bank:demo","operation":"transfer"}},"authority_grant":{"principal":"human:demo","scope":{"max_amount":"25.00","currency":"CAD","destination":"merchant:demo","tool_id":"bank:demo","operation":"transfer"},"expires_at":"2026-09-06T13:00:00Z","nonce":"aaaaaaaaaaaaaaaaaaaaaaaaaaaaaaaa","issued_at":"2026-09-06T12:00:00Z","agent":"agent:demo","action_digest":"sha256:d3003a6eb686a5076d94d575a32a9ff79d2e01c260b663482cf51a28ab8b156f","delegation_parent":null},"authority_proof":{"type":"ddcar-ed25519-v1","key_id":"authority-key","signature":"oUEQNyDw6DsL-wEKD5WvCoLKNmca-3FLNUUKUoIA2XreOdG1hcnTdlmyGowkBJBeXHhpVaCJyY2hJtkEuWjRDg"},"requested_action":{"tool":{"kind":"api","id":"bank:demo","version":"1","schema_digest":"sha256:c5e6f843ad7c14e24e105c9222522e286fbcae8759491f10f960adca9f5e20eb"},"operation":"transfer","parameters":{"amount":"10.00","currency":"CAD","to":"merchant:demo"}},"requested_action_digest":"sha256:d3003a6eb686a5076d94d575a32a9ff79d2e01c260b663482cf51a28ab8b156f","evidence":[{"type":"state","digest":"sha256:e45d4d560021e4f98c8ed65307e14192760df59bde092e5176ac8e2a454c3ed0","observed_at":"2026-09-06T12:00:00Z","valid_until":"2026-09-06T13:00:00Z"}],"policy":{"id":"demo-policy","version":"1","digest":"sha256:7e5797ae3ca604aa3150e353c108e4a8fa6ea515c5fb572cf102d83296554e17"},"prerequisites":[{"status":"PASS"}],"permissions":[{"status":"PASS"}],"assurance":{"semantic":{"status":"PASS"},"authority":{"status":"PASS"},"state":{"status":"PASS"},"resource":{"status":"PASS"},"security":{"status":"PASS"},"physical":{"status":"PASS"},"lineage":{"status":"PASS"}},"anomalies":[],"risk":{"class":"low"},"decision":"ALLOW","issuer":{"id":"gate:demo"},"lineage":{"previous":[],"delegation_parent":null},"decision_proof":{"type":"ddcar-ed25519-v1","key_id":"decision-key","signature":"tNWNaWWhzjLWnXE0dUb98awl0u54CELKFAc_iwZRSJ_9KKqc66AXUWTSx1TfETt4SzDWL41jgZwfQJTMhsR0CQ"},"execution":{"exact_action":{"tool":{"kind":"api","id":"bank:demo","version":"1","schema_digest":"sha256:c5e6f843ad7c14e24e105c9222522e286fbcae8759491f10f960adca9f5e20eb"},"operation":"transfer","parameters":{"amount":"10.00","currency":"CAD","to":"merchant:demo"}},"exact_action_digest":"sha256:d3003a6eb686a5076d94d575a32a9ff79d2e01c260b663482cf51a28ab8b156f","outcome":{"status":"SUCCEEDED","evidence_digest":"sha256:250223fcf2509ef3b1d0cc2babd96814b004135bc6383d1eafc97e96f3e88c01"},"executor":{"id":"executor:demo"},"observed_at":"2026-09-06T12:05:00Z"},"execution_proof":{"type":"ddcar-ed25519-v1","key_id":"execution-key","signature":"FFT0TMSdXoAFr2lfn0uIZVYZeFYBMhghjoev_wGgLvam-Hg5b2Gy9a7NcYOSWZZm4u8Jwf_QvXIVBp64M2rYDA"}}
